{
  "schemaVersion": 1,
  "datasetId": "san11.generic.gamersky2009.20261007",
  "evidence": "public-guide-transcription",
  "executionEnabled": false,
  "versionScope": {
    "edition": "PK",
    "platform": null,
    "patch": null,
    "basis": "article-title-and-introduction"
  },
  "conditionMeaning": "Source descriptions only. Missing conditions mean not stated, never unconditional eligibility or negative evidence.",
  "resultOrderMeaning": "Guide-description order only, not native stores or callback order.",
  "observations": [
    {
      "eventId": "generic.bronze-sparrow-acquisition",
      "observationId": "generic.gamersky2009.01.bronze-sparrow",
      "sourceId": "gamersky-2009-01",
      "sourceURL": "https://www.gamersky.com/handbook/200902/134257.shtml",
      "sourceSection": "铜雀台",
      "sourceOrdinal": 1,
      "ordinalScope": "selected-observations-on-page",
      "sourceLocator": {
        "startLine": 275,
        "endLine": 276
      },
      "snapshotSha256": "9b38bf7a82ec854ddcece92a618619289180b443cd289fe891f18e222da2c479",
      "evidence": "public-guide-transcription",
      "executionEnabled": false,
      "coverageKind": "supplementary",
      "nativeEventId": null,
      "onceOnly": {
        "status": "not-stated",
        "flagId": null
      },
      "triggerProbability": null,
      "conditionCompleteness": "partial-source-description",
      "resultCompleteness": "partial-source-description",
      "conditions": [
        {
          "scope": "event",
          "text": "2009年1月26日补记称官职达到大司马，君主前往字面地点“邻”。“邻”疑似错字但未裁决，不自动更正为邺；也不把“达到”擅自扩成排序阈值。",
          "certainty": "source-ambiguous",
          "sourceLocator": {
            "startLine": 276,
            "endLine": 276
          },
          "quantities": []
        }
      ],
      "results": [
        {
          "scope": "event",
          "text": "补记称可取得铜雀；没有复述Wiki的其他条件，不代表否定或免除这些条件。",
          "certainty": "source-stated",
          "sourceLocator": {
            "startLine": 276,
            "endLine": 276
          },
          "quantities": []
        }
      ],
      "annotations": []
    },
    {
      "eventId": "generic.taishan-fengshan",
      "observationId": "generic.gamersky2009.13.taishan",
      "sourceId": "gamersky-2009-13",
      "sourceURL": "https://www.gamersky.com/handbook/200902/134257_13.shtml",
      "sourceSection": "泰山封禅",
      "sourceOrdinal": 1,
      "ordinalScope": "selected-observations-on-page",
      "sourceLocator": {
        "startLine": 336,
        "endLine": 342
      },
      "snapshotSha256": "1fd8f99a7cfb8af92133be43e10e802eb59badaac7222e38dc0ca5528b356d22",
      "evidence": "public-guide-transcription",
      "executionEnabled": false,
      "coverageKind": "supplementary",
      "nativeEventId": null,
      "onceOnly": {
        "status": "not-stated",
        "flagId": null
      },
      "triggerProbability": null,
      "conditionCompleteness": "partial-source-description",
      "resultCompleteness": "partial-source-description",
      "conditions": [
        {
          "scope": "event",
          "text": "君主爵位为皇帝。",
          "certainty": "source-stated",
          "sourceLocator": {
            "startLine": 339,
            "endLine": 339
          },
          "quantities": []
        },
        {
          "scope": "event",
          "text": "支配小沛。",
          "certainty": "source-stated",
          "sourceLocator": {
            "startLine": 340,
            "endLine": 340
          },
          "quantities": []
        }
      ],
      "results": [
        {
          "scope": "event",
          "text": "君主能力、适性上升；没有数额，也未区分能力数值、适性等级和经验，不能从Wiki补值。",
          "certainty": "source-stated",
          "sourceLocator": {
            "startLine": 342,
            "endLine": 342
          },
          "quantities": [
            {
              "name": "ruler-abilities",
              "operator": "qualitative",
              "value": null,
              "unit": "unspecified"
            },
            {
              "name": "ruler-aptitude",
              "operator": "qualitative",
              "value": null,
              "unit": "unspecified"
            }
          ]
        }
      ],
      "annotations": []
    }
  ]
}
